[
  { "year": "1961", "mission": "Venera 1 (USSR)", "note": "[LOST CONTACT]", "type": "FLYBY", "highlight": false, "link": "https://nextspaceflight.com/launches/details/3811/" },
  { "year": "1962", "mission": "Mariner 2 (USA)", "note": "", "type": "SUCCESSFUL FLYBY", "highlight": true, "link": "https://science.nasa.gov/mission/mariner-2/" },
  { "year": "1964-65", "mission": "Zond 1, Venera 2/3 (USSR)", "note": "", "type": "FAILED/IMPACT", "highlight": false, "link": null },
  { "year": "1967", "mission": "Venera 4 (USSR)", "note": "", "type": "ATMOSPHERIC PROBE", "highlight": false, "link": "https://www.esa.int/ESA_Multimedia/Images/2004/06/Venera_4_the_first_spacecraft_to_return_data_about_the_atmosphere_of_Venus" },
  { "year": "1967", "mission": "Mariner 5 (USA)", "note": "", "type": "FLYBY", "highlight": false, "link": "https://science.nasa.gov/mission/mariner-5/" },
  { "year": "1970", "mission": "Venera 7 (USSR)", "note": "", "type": "FIRST LANDING", "highlight": true, "link": "https://www.space.com/30276-venera-7-venus-lander-launch-45th-anniversary.html" },
  { "year": "1972", "mission": "Venera 8 (USSR)", "note": "", "type": "LANDER", "highlight": false, "link": null },
  { "year": "1974", "mission": "Mariner 10 (USA)", "note": "", "type": "FLYBY", "highlight": false, "link": "https://science.nasa.gov/mission/mariner-10/" },
  { "year": "1975", "mission": "Venera 9 & 10 (USSR)", "note": "", "type": "ORBITER/LANDER", "highlight": false, "link": null },
  { "year": "1978", "mission": "Pioneer Venus 1 & 2 (USA)", "note": "", "type": "ORBITER/MULTIPROBE", "highlight": true, "link": "https://science.nasa.gov/mission/pioneer-venus-1/" },
  { "year": "1978", "mission": "Venera 11 & 12 (USSR)", "note": "", "type": "LANDER", "highlight": false, "link": null },
  { "year": "1981", "mission": "Venera 13 & 14 (USSR)", "note": "", "type": "LANDER/COLOR IMG", "highlight": false, "link": null },
  { "year": "1983", "mission": "Venera 15 & 16 (USSR)", "note": "", "type": "ORBITER/RADAR", "highlight": false, "link": null },
  { "year": "1985", "mission": "Vega 1 & 2 (USSR)", "note": "", "type": "BALLOON AEROSTAT", "highlight": true, "link": "https://pds.mcp.nasa.gov/portal/investigations/urn--nasa--pds--context--investigation--mission---vega----1/overview" },
  { "year": "1989", "mission": "Magellan (USA)", "note": "", "type": "RADAR MAPPING", "highlight": true, "link": "https://science.nasa.gov/mission/magellan/" },
  { "year": "1990", "mission": "Galileo (USA)", "note": "", "type": "GRAVITY ASSIST", "highlight": false, "link": "https://science.nasa.gov/mission/galileo/" },
  { "year": "2005", "mission": "Venus Express (ESA)", "note": "", "type": "ATMOSPHERIC ORBITER", "highlight": false, "link": "https://www.esa.int/Science_Exploration/Space_Science/Venus_Express" },
  { "year": "2010", "mission": "Akatsuki (JAXA)", "note": "", "type": "CLIMATE ORBITER", "highlight": false, "link": "https://akatsuki.isas.jaxa.jp/en/" },
  { "year": "2018+", "mission": "Parker Solar Probe (NASA)", "note": "", "type": "GRAVITY ASSIST", "highlight": false, "link": "https://www.nasa.gov/general/parker-solar-probe-captures-its-first-images-of-venus-surface-in-visible-light-confirmed/" },
  { "year": "2018+", "mission": "BepiColombo (ESA/JAXA)", "note": "", "type": "GRAVITY ASSIST", "highlight": false, "link": "https://www.esa.int/Science_Exploration/Space_Science/BepiColombo/BepiColombo_flies_by_Venus_en_route_to_Mercury" },
  { "year": "2018+", "mission": "Solar Orbiter (ESA/NASA)", "note": "", "type": "GRAVITY ASSIST", "highlight": false, "link": "https://www.nasa.gov/image-article/during-close-pass-solar-orbiter-captures-venus-glare/" }
]
